{
  "settimana": "2026-10-12",
  "sintesi": "Settimana dominata da nuove frodi con voce sintetica (tre notizie concordanti su NFR-01) e da una vertenza sindacale nazionale del settore con carenza di tecnici IT: e' il segnale di avvicinamento di NFR-16, rischio in osservazione sui rapporti di impiego.",
  "notizie": [
    {
      "id_notizia": "N-20261006-01",
      "data": "2026-10-06",
      "titolo": "Sciopero nazionale del personale bancario e carenza di tecnici IT",
      "fonte": "Agenzia di stampa",
      "codice_fonte": "FNT-17",
      "sintesi": "I sindacati proclamano due giornate di sciopero; le banche segnalano difficolta' a coprire ruoli tecnici critici.",
      "rischio_collegato": "NFR-16",
      "segnale": "Peggiorativo",
      "impatti": [
        {
          "event_type": "9.1",
          "intensita": 0,
          "direzione": "Non rilevante"
        },
        {
          "event_type": "9.4",
          "intensita": 0,
          "direzione": "Non rilevante"
        },
        {
          "event_type": "9.5",
          "intensita": 0,
          "direzione": "Non rilevante"
        },
        {
          "event_type": "9.6",
          "intensita": 0,
          "direzione": "Non rilevante"
        },
        {
          "event_type": "9.7",
          "intensita": 0,
          "direzione": "Non rilevante"
        },
        {
          "event_type": "9.8",
          "intensita": 0,
          "direzione": "Non rilevante"
        },
        {
          "event_type": "9.9",
          "intensita": 1,
          "direzione": "Peggiorativo"
        },
        {
          "event_type": "9.11",
          "intensita": 2,
          "direzione": "Peggiorativo"
        },
        {
          "event_type": "9.13",
          "intensita": 1,
          "direzione": "Peggiorativo"
        }
      ]
    },
    {
      "id_notizia": "N-20261007-01",
      "data": "2026-10-07",
      "titolo": "Frode con voce clonata del direttore finanziario presso un gruppo industriale",
      "fonte": "Stampa economica",
      "codice_fonte": "FNT-18",
      "sintesi": "Bonifico istantaneo da 3 milioni disposto su richiesta telefonica con voce sintetica.",
      "rischio_collegato": "NFR-01",
      "segnale": "Peggiorativo",
      "impatti": [
        {
          "event_type": "9.1",
          "intensita": 1,
          "direzione": "Peggiorativo"
        },
        {
          "event_type": "9.4",
          "intensita": 0,
          "direzione": "Non rilevante"
        },
        {
          "event_type": "9.5",
          "intensita": 0,
          "direzione": "Non rilevante"
        },
        {
          "event_type": "9.6",
          "intensita": 0,
          "direzione": "Non rilevante"
        },
        {
          "event_type": "9.7",
          "intensita": 3,
          "direzione": "Peggiorativo"
        },
        {
          "event_type": "9.8",
          "intensita": 0,
          "direzione": "Non rilevante"
        },
        {
          "event_type": "9.9",
          "intensita": 0,
          "direzione": "Non rilevante"
        },
        {
          "event_type": "9.11",
          "intensita": 0,
          "direzione": "Non rilevante"
        },
        {
          "event_type": "9.13",
          "intensita": 0,
          "direzione": "Non rilevante"
        }
      ]
    },
    {
      "id_notizia": "N-20261008-01",
      "data": "2026-10-08",
      "titolo": "Il CERT finanziario segnala kit di clonazione vocale in vendita",
      "fonte": "CERT finanziario nazionale",
      "codice_fonte": "FNT-34",
      "sintesi": "Strumenti pronti all'uso abbassano la soglia d'ingresso per le frodi APP.",
      "rischio_collegato": "NFR-01",
      "segnale": "Peggiorativo",
      "impatti": [
        {
          "event_type": "9.1",
          "intensita": 0,
          "direzione": "Non rilevante"
        },
        {
          "event_type": "9.4",
          "intensita": 0,
          "direzione": "Non rilevante"
        },
        {
          "event_type": "9.5",
          "intensita": 0,
          "direzione": "Non rilevante"
        },
        {
          "event_type": "9.6",
          "intensita": 0,
          "direzione": "Non rilevante"
        },
        {
          "event_type": "9.7",
          "intensita": 2,
          "direzione": "Peggiorativo"
        },
        {
          "event_type": "9.8",
          "intensita": 0,
          "direzione": "Non rilevante"
        },
        {
          "event_type": "9.9",
          "intensita": 0,
          "direzione": "Non rilevante"
        },
        {
          "event_type": "9.11",
          "intensita": 0,
          "direzione": "Non rilevante"
        },
        {
          "event_type": "9.13",
          "intensita": 0,
          "direzione": "Non rilevante"
        }
      ]
    },
    {
      "id_notizia": "N-20261008-02",
      "data": "2026-10-08",
      "titolo": "Il fornitore cloud completa la nuova region italiana",
      "fonte": "Comunicato stampa del fornitore cloud, sito del fornitore",
      "codice_fonte": "MAN",
      "sintesi": "La region e' disponibile; nessun impatto immediato sui servizi della Banca.",
      "rischio_collegato": "NFR-02",
      "segnale": "Neutro",
      "impatti": [
        {
          "event_type": "9.1",
          "intensita": 0,
          "direzione": "Non rilevante"
        },
        {
          "event_type": "9.4",
          "intensita": 0,
          "direzione": "Non rilevante"
        },
        {
          "event_type": "9.5",
          "intensita": 0,
          "direzione": "Non rilevante"
        },
        {
          "event_type": "9.6",
          "intensita": 0,
          "direzione": "Non rilevante"
        },
        {
          "event_type": "9.7",
          "intensita": 0,
          "direzione": "Non rilevante"
        },
        {
          "event_type": "9.8",
          "intensita": 0,
          "direzione": "Non rilevante"
        },
        {
          "event_type": "9.9",
          "intensita": 1,
          "direzione": "Neutro"
        },
        {
          "event_type": "9.11",
          "intensita": 0,
          "direzione": "Non rilevante"
        },
        {
          "event_type": "9.13",
          "intensita": 0,
          "direzione": "Non rilevante"
        }
      ]
    },
    {
      "id_notizia": "N-20261009-01",
      "data": "2026-10-09",
      "titolo": "Autorita' europea: rimborso obbligatorio delle frodi APP dal 2027",
      "fonte": "Autorita' bancaria europea",
      "codice_fonte": "FNT-03",
      "sintesi": "Il rimborso a carico del prestatore di servizi di pagamento diventa obbligatorio per le frodi autorizzate.",
      "rischio_collegato": "NFR-01",
      "segnale": "Peggiorativo",
      "impatti": [
        {
          "event_type": "9.1",
          "intensita": 2,
          "direzione": "Peggiorativo"
        },
        {
          "event_type": "9.4",
          "intensita": 0,
          "direzione": "Non rilevante"
        },
        {
          "event_type": "9.5",
          "intensita": 0,
          "direzione": "Non rilevante"
        },
        {
          "event_type": "9.6",
          "intensita": 0,
          "direzione": "Non rilevante"
        },
        {
          "event_type": "9.7",
          "intensita": 2,
          "direzione": "Peggiorativo"
        },
        {
          "event_type": "9.8",
          "intensita": 0,
          "direzione": "Non rilevante"
        },
        {
          "event_type": "9.9",
          "intensita": 0,
          "direzione": "Non rilevante"
        },
        {
          "event_type": "9.11",
          "intensita": 0,
          "direzione": "Non rilevante"
        },
        {
          "event_type": "9.13",
          "intensita": 0,
          "direzione": "Non rilevante"
        }
      ]
    }
  ],
  "flag_proposti": [
    {
      "id_rischio": "NFR-01",
      "direzione": "Peggiorativo",
      "motivazione": "L'obbligo di rimborso delle frodi APP dal 2027 sposta la perdita sulla Banca: il descrittore di impatto 4 potrebbe non bastare. Da valutare nel prossimo ciclo trimestrale."
    },
    {
      "id_rischio": "NFR-16",
      "direzione": "Peggiorativo",
      "motivazione": "N-20261006-01: lo sciopero nazionale del personale bancario coinvolge i tecnici IT: si e' verificato il segnale di avvicinamento di NFR-16, in osservazione. Da rivalutare nel prossimo ciclo trimestrale Prossimita e Probabilita: puo' entrare nel radar."
    }
  ]
}