{
  "settimana": "2026-11-16",
  "sintesi": "Una sola notizia, critica: il primo caso in Italia di frode con voce clonata ai danni del cliente corporate di una banca comparabile. Proposta di ciclo straordinario su NFR-01.",
  "notizie": [
    {
      "id_notizia": "N-20261113-01",
      "data": "2026-11-13",
      "titolo": "Bonifico istantaneo da 5 milioni disposto con la voce clonata dell'amministratore delegato",
      "fonte": "Stampa economica",
      "codice_fonte": "FNT-18",
      "sintesi": "Il cliente corporate di una banca italiana comparabile ha autorizzato il bonifico su richiesta telefonica con voce sintetica; la banca non ha bloccato il beneficiario.",
      "rischio_collegato": "NFR-01",
      "segnale": "Peggiorativo",
      "impatti": [
        {
          "event_type": "9.1",
          "intensita": 1,
          "direzione": "Peggiorativo"
        },
        {
          "event_type": "9.4",
          "intensita": 0,
          "direzione": "Non rilevante"
        },
        {
          "event_type": "9.5",
          "intensita": 0,
          "direzione": "Non rilevante"
        },
        {
          "event_type": "9.6",
          "intensita": 0,
          "direzione": "Non rilevante"
        },
        {
          "event_type": "9.7",
          "intensita": 3,
          "direzione": "Peggiorativo"
        },
        {
          "event_type": "9.8",
          "intensita": 0,
          "direzione": "Non rilevante"
        },
        {
          "event_type": "9.9",
          "intensita": 0,
          "direzione": "Non rilevante"
        },
        {
          "event_type": "9.11",
          "intensita": 0,
          "direzione": "Non rilevante"
        },
        {
          "event_type": "9.13",
          "intensita": 0,
          "direzione": "Non rilevante"
        }
      ]
    }
  ],
  "flag_proposti": [],
  "proposta_straordinario": {
    "rischi": [
      "NFR-01"
    ],
    "motivo": "Intensita' 3 su NFR-01, che ha Impatto 4: il primo caso presso una banca comparabile rende superato il descrittore di Probabilita 4."
  }
}